{
  "courseId": "c09-talking-about-plans-goals-and-personal-change-b2",
  "finalSentences": [
    {
      "order": 1,
      "slot": 1,
      "section": "建立任务",
      "role": "说明当前最重要的方向和近期计划",
      "text": "I'm focusing on improving my health right now.",
      "translation": "我现在专注于改善我的健康。",
      "difficultyBand": "entry",
      "usedChunks": [
        "I'm focusing"
      ],
      "sourceCandidateId": "s01-a",
      "edited": false,
      "selectionReason": "在两项候选中选择更直接、自然且便于迁移的一句。"
    },
    {
      "order": 2,
      "slot": 2,
      "section": "建立任务",
      "role": "说明当前最重要的方向和近期计划",
      "text": "I'm planning to start a new hobby next month.",
      "translation": "我计划下个月开始一个新爱好。",
      "difficultyBand": "entry",
      "usedChunks": [
        "I'm planning to"
      ],
      "sourceCandidateId": "s02-a",
      "edited": false,
      "selectionReason": "在两项候选中选择更直接、自然且便于迁移的一句。"
    },
    {
      "order": 3,
      "slot": 3,
      "section": "建立任务",
      "role": "说明当前最重要的方向和近期计划",
      "text": "This week, I'm dedicating time to finish my book.",
      "translation": "这周我会专心完成我的书。",
      "difficultyBand": "entry",
      "usedChunks": [
        "This week,"
      ],
      "sourceCandidateId": "s03-a",
      "edited": false,
      "selectionReason": "在两项候选中选择更直接、自然且便于迁移的一句。"
    },
    {
      "order": 4,
      "slot": 4,
      "section": "建立任务",
      "role": "说明当前最重要的方向和近期计划",
      "text": "I'm setting aside time to volunteer at the local shelter.",
      "translation": "我正在安排时间去当地的收容所做志愿者。",
      "difficultyBand": "targetBase",
      "usedChunks": [
        "I'm setting"
      ],
      "sourceCandidateId": "s04-a",
      "edited": false,
      "selectionReason": "在两项候选中选择更直接、自然且便于迁移的一句。"
    },
    {
      "order": 5,
      "slot": 5,
      "section": "补充关键信息",
      "role": "描述长期目标以及它对自己的意义",
      "text": "I want to travel to every continent before I turn 50.",
      "translation": "我想在50岁之前游遍每个大陆。",
      "difficultyBand": "targetBase",
      "usedChunks": [
        "I want"
      ],
      "sourceCandidateId": "s05-a",
      "edited": false,
      "selectionReason": "在两项候选中选择更直接、自然且便于迁移的一句。"
    },
    {
      "order": 6,
      "slot": 6,
      "section": "补充关键信息",
      "role": "描述长期目标以及它对自己的意义",
      "text": "My main goal is to become more self-sufficient.",
      "translation": "我的主要目标是变得更加自给自足。",
      "difficultyBand": "targetBase",
      "usedChunks": [
        "My main goal is"
      ],
      "sourceCandidateId": "s06-a",
      "edited": false,
      "selectionReason": "在两项候选中选择更直接、自然且便于迁移的一句。"
    },
    {
      "order": 7,
      "slot": 7,
      "section": "补充关键信息",
      "role": "描述长期目标以及它对自己的意义",
      "text": "I hope to make a positive impact on my community.",
      "translation": "我希望对我的社区产生积极影响。",
      "difficultyBand": "targetBase",
      "usedChunks": [
        "I hope"
      ],
      "sourceCandidateId": "s07-a",
      "edited": false,
      "selectionReason": "在两项候选中选择更直接、自然且便于迁移的一句。"
    },
    {
      "order": 8,
      "slot": 8,
      "section": "补充关键信息",
      "role": "描述长期目标以及它对自己的意义",
      "text": "Achieving financial independence is important to me.",
      "translation": "实现财务独立对我来说很重要。",
      "difficultyBand": "targetCore",
      "usedChunks": [
        "Achieving financial"
      ],
      "sourceCandidateId": "s08-a",
      "edited": false,
      "selectionReason": "在两项候选中选择更直接、自然且便于迁移的一句。"
    },
    {
      "order": 9,
      "slot": 9,
      "section": "处理回应与变化",
      "role": "说明现实障碍、优先级冲突和不确定性",
      "text": "Balancing work and personal life is challenging.",
      "translation": "平衡工作和个人生活是有挑战性的。",
      "difficultyBand": "targetCore",
      "usedChunks": [
        "Balancing work"
      ],
      "sourceCandidateId": "s09-a",
      "edited": false,
      "selectionReason": "在两项候选中选择更直接、自然且便于迁移的一句。"
    },
    {
      "order": 10,
      "slot": 10,
      "section": "处理回应与变化",
      "role": "说明现实障碍、优先级冲突和不确定性",
      "text": "I've realized that I need to prioritize my mental health.",
      "translation": "我意识到我需要优先考虑我的心理健康。",
      "difficultyBand": "targetCore",
      "usedChunks": [
        "I've realized that"
      ],
      "sourceCandidateId": "s10-a",
      "edited": false,
      "selectionReason": "在两项候选中选择更直接、自然且便于迁移的一句。"
    },
    {
      "order": 11,
      "slot": 11,
      "section": "处理回应与变化",
      "role": "说明现实障碍、优先级冲突和不确定性",
      "text": "Sometimes, unexpected events disrupt my plans.",
      "translation": "有时，意外事件会打乱我的计划。",
      "difficultyBand": "targetCore",
      "usedChunks": [
        "Sometimes, unexpected"
      ],
      "sourceCandidateId": "s11-a",
      "edited": false,
      "selectionReason": "在两项候选中选择更直接、自然且便于迁移的一句。"
    },
    {
      "order": 12,
      "slot": 12,
      "section": "处理回应与变化",
      "role": "说明现实障碍、优先级冲突和不确定性",
      "text": "Uncertainty about the future makes planning difficult.",
      "translation": "对未来的不确定性使计划变得困难。",
      "difficultyBand": "targetCore",
      "usedChunks": [
        "Uncertainty about"
      ],
      "sourceCandidateId": "s12-a",
      "edited": false,
      "selectionReason": "在两项候选中选择更直接、自然且便于迁移的一句。"
    },
    {
      "order": 13,
      "slot": 13,
      "section": "完成交流",
      "role": "比较过去与现在，并表达根据情况调整计划的方式",
      "text": "I used to be more spontaneous, but now I plan ahead.",
      "translation": "我过去比较随性，但现在我会提前计划。",
      "difficultyBand": "stretch",
      "usedChunks": [
        "I used"
      ],
      "sourceCandidateId": "s13-a",
      "edited": false,
      "selectionReason": "在两项候选中选择更直接、自然且便于迁移的一句。"
    },
    {
      "order": 14,
      "slot": 14,
      "section": "完成交流",
      "role": "比较过去与现在，并表达根据情况调整计划的方式",
      "text": "In the past, I focused more on short-term goals.",
      "translation": "过去，我更注重短期目标。",
      "difficultyBand": "targetCore",
      "usedChunks": [
        "In the past, I"
      ],
      "sourceCandidateId": "s14-a",
      "edited": false,
      "selectionReason": "在两项候选中选择更直接、自然且便于迁移的一句。"
    },
    {
      "order": 15,
      "slot": 15,
      "section": "完成交流",
      "role": "比较过去与现在，并表达根据情况调整计划的方式",
      "text": "I've adapted my plans to fit my current lifestyle.",
      "translation": "我调整了我的计划以适应我目前的生活方式。",
      "difficultyBand": "stretch",
      "usedChunks": [
        "I've adapted"
      ],
      "sourceCandidateId": "s15-a",
      "edited": false,
      "selectionReason": "在两项候选中选择更直接、自然且便于迁移的一句。"
    },
    {
      "order": 16,
      "slot": 16,
      "section": "完成交流",
      "role": "比较过去与现在，并表达根据情况调整计划的方式",
      "text": "I've learned to be flexible with my expectations.",
      "translation": "我学会了对自己的期望保持灵活性。",
      "difficultyBand": "stretch",
      "usedChunks": [
        "I've learned"
      ],
      "sourceCandidateId": "s16-a",
      "edited": false,
      "selectionReason": "在两项候选中选择更直接、自然且便于迁移的一句。"
    }
  ],
  "regenerateSlots": [],
  "courseReview": {
    "recommendation": "approve",
    "learnerOutcomeFit": "16 句覆盖冻结课程目标。",
    "naturalness": "已由独立语言审查确认。",
    "realWorldUsefulness": "每句可独立用于真实交流。",
    "coreChunkCoverage": "核心表达按蓝图覆盖。",
    "difficultyDistribution": "保持 3/4/6/3 配额。",
    "difficultyCurve": "由基础表达逐步加入细节和整合。",
    "repetitionQuality": "避免仅替换名词的伪变化。",
    "fillerRisk": "低。"
  },
  "humanReviewFocus": [
    "抽查挑战句的自然口语感。"
  ],
  "needsHumanReview": true
}
