{
  "courseId": "c07-explaining-preferences-and-an-ideal-lifestyle-b1",
  "finalSentences": [
    {
      "order": 1,
      "slot": 1,
      "section": "建立任务",
      "role": "表达对生活节奏、环境和日常安排的偏好",
      "text": "I like starting my day with a quiet breakfast.",
      "translation": "我喜欢以安静的早餐开始我的一天。",
      "difficultyBand": "entry",
      "usedChunks": [
        "I like"
      ],
      "sourceCandidateId": "s01-a",
      "edited": false,
      "selectionReason": "在两项候选中选择更直接、自然且便于迁移的一句。"
    },
    {
      "order": 2,
      "slot": 2,
      "section": "建立任务",
      "role": "表达对生活节奏、环境和日常安排的偏好",
      "text": "I prefer a lifestyle where I can work from home.",
      "translation": "我更喜欢可以在家工作的生活方式。",
      "difficultyBand": "entry",
      "usedChunks": [
        "I prefer a lifestyle where"
      ],
      "sourceCandidateId": "s02-a",
      "edited": false,
      "selectionReason": "在两项候选中选择更直接、自然且便于迁移的一句。"
    },
    {
      "order": 3,
      "slot": 3,
      "section": "建立任务",
      "role": "表达对生活节奏、环境和日常安排的偏好",
      "text": "I love spending my evenings reading.",
      "translation": "我喜欢在晚上读书。",
      "difficultyBand": "entry",
      "usedChunks": [
        "I love"
      ],
      "sourceCandidateId": "s03-a",
      "edited": false,
      "selectionReason": "在两项候选中选择更直接、自然且便于迁移的一句。"
    },
    {
      "order": 4,
      "slot": 4,
      "section": "建立任务",
      "role": "表达对生活节奏、环境和日常安排的偏好",
      "text": "Being outdoors in nature is important to me.",
      "translation": "待在户外亲近自然对我很重要。",
      "difficultyBand": "targetBase",
      "usedChunks": [
        "Being outdoors"
      ],
      "sourceCandidateId": "s04-a",
      "edited": false,
      "selectionReason": "在两项候选中选择更直接、自然且便于迁移的一句。"
    },
    {
      "order": 5,
      "slot": 5,
      "section": "补充关键信息",
      "role": "描述理想的一天或理想生活状态",
      "text": "An ideal day for me would start with a morning jog.",
      "translation": "对我来说，理想的一天会从晨跑开始。",
      "difficultyBand": "targetBase",
      "usedChunks": [
        "An ideal"
      ],
      "sourceCandidateId": "s05-a",
      "edited": false,
      "selectionReason": "在两项候选中选择更直接、自然且便于迁移的一句。"
    },
    {
      "order": 6,
      "slot": 6,
      "section": "补充关键信息",
      "role": "描述理想的一天或理想生活状态",
      "text": "My ideal day includes spending time with family.",
      "translation": "我理想的一天包括和家人在一起。",
      "difficultyBand": "targetBase",
      "usedChunks": [
        "My ideal day includes"
      ],
      "sourceCandidateId": "s06-a",
      "edited": false,
      "selectionReason": "在两项候选中选择更直接、自然且便于迁移的一句。"
    },
    {
      "order": 7,
      "slot": 7,
      "section": "补充关键信息",
      "role": "描述理想的一天或理想生活状态",
      "text": "I would love to have a day full of creative activities.",
      "translation": "我希望有一天能充满创意活动。",
      "difficultyBand": "targetBase",
      "usedChunks": [
        "I would"
      ],
      "sourceCandidateId": "s07-a",
      "edited": false,
      "selectionReason": "在两项候选中选择更直接、自然且便于迁移的一句。"
    },
    {
      "order": 8,
      "slot": 8,
      "section": "补充关键信息",
      "role": "描述理想的一天或理想生活状态",
      "text": "In my ideal life, I would have time for hobbies every day.",
      "translation": "在我理想的生活中，我每天都有时间做爱好。",
      "difficultyBand": "targetCore",
      "usedChunks": [
        "In my"
      ],
      "sourceCandidateId": "s08-a",
      "edited": false,
      "selectionReason": "在两项候选中选择更直接、自然且便于迁移的一句。"
    },
    {
      "order": 9,
      "slot": 9,
      "section": "处理回应与变化",
      "role": "说明偏好背后的原因和感受",
      "text": "I like quiet mornings because they help me focus.",
      "translation": "我喜欢安静的早晨，因为它们能帮助我集中注意力。",
      "difficultyBand": "targetCore",
      "usedChunks": [
        "I like"
      ],
      "sourceCandidateId": "s09-a",
      "edited": false,
      "selectionReason": "在两项候选中选择更直接、自然且便于迁移的一句。"
    },
    {
      "order": 10,
      "slot": 10,
      "section": "处理回应与变化",
      "role": "说明偏好背后的原因和感受",
      "text": "I feel happiest when I'm surrounded by nature.",
      "translation": "当我被大自然包围时，我感到最快乐。",
      "difficultyBand": "targetCore",
      "usedChunks": [
        "I feel happiest when"
      ],
      "sourceCandidateId": "s10-a",
      "edited": false,
      "selectionReason": "在两项候选中选择更直接、自然且便于迁移的一句。"
    },
    {
      "order": 11,
      "slot": 11,
      "section": "处理回应与变化",
      "role": "说明偏好背后的原因和感受",
      "text": "I enjoy a structured day because it keeps me organized.",
      "translation": "我喜欢有条理的一天，因为它让我保持井井有条。",
      "difficultyBand": "targetCore",
      "usedChunks": [
        "I enjoy"
      ],
      "sourceCandidateId": "s11-a",
      "edited": false,
      "selectionReason": "在两项候选中选择更直接、自然且便于迁移的一句。"
    },
    {
      "order": 12,
      "slot": 12,
      "section": "处理回应与变化",
      "role": "说明偏好背后的原因和感受",
      "text": "I like working in a quiet space because it boosts my productivity.",
      "translation": "我喜欢在安静的空间工作，因为它能提高我的工作效率。",
      "difficultyBand": "targetCore",
      "usedChunks": [
        "I like"
      ],
      "sourceCandidateId": "s12-a",
      "edited": false,
      "selectionReason": "在两项候选中选择更直接、自然且便于迁移的一句。"
    },
    {
      "order": 13,
      "slot": 13,
      "section": "完成交流",
      "role": "承认现实限制并表达可以接受的折中",
      "text": "I can't always travel, but I enjoy exploring my city.",
      "translation": "我不能总是旅行，但我喜欢探索我的城市。",
      "difficultyBand": "stretch",
      "usedChunks": [
        "I can't"
      ],
      "sourceCandidateId": "s13-a",
      "edited": false,
      "selectionReason": "在两项候选中选择更直接、自然且便于迁移的一句。"
    },
    {
      "order": 14,
      "slot": 14,
      "section": "完成交流",
      "role": "承认现实限制并表达可以接受的折中",
      "text": "I can compromise by working part-time to have more free time.",
      "translation": "我可以通过兼职工作来妥协，以获得更多的空闲时间。",
      "difficultyBand": "targetCore",
      "usedChunks": [
        "I can compromise by"
      ],
      "sourceCandidateId": "s14-a",
      "edited": false,
      "selectionReason": "在两项候选中选择更直接、自然且便于迁移的一句。"
    },
    {
      "order": 15,
      "slot": 15,
      "section": "完成交流",
      "role": "承认现实限制并表达可以接受的折中",
      "text": "I can't live by the ocean, but I visit the beach often.",
      "translation": "我不能住在海边，但我经常去海滩。",
      "difficultyBand": "stretch",
      "usedChunks": [
        "I can't"
      ],
      "sourceCandidateId": "s15-a",
      "edited": false,
      "selectionReason": "在两项候选中选择更直接、自然且便于迁移的一句。"
    },
    {
      "order": 16,
      "slot": 16,
      "section": "完成交流",
      "role": "承认现实限制并表达可以接受的折中",
      "text": "I can't have a big house, but I make my small space cozy.",
      "translation": "我不能拥有大房子，但我让我的小空间变得舒适。",
      "difficultyBand": "stretch",
      "usedChunks": [
        "I can't"
      ],
      "sourceCandidateId": "s16-a",
      "edited": false,
      "selectionReason": "在两项候选中选择更直接、自然且便于迁移的一句。"
    }
  ],
  "regenerateSlots": [],
  "courseReview": {
    "recommendation": "approve",
    "learnerOutcomeFit": "16 句覆盖冻结课程目标。",
    "naturalness": "已由独立语言审查确认。",
    "realWorldUsefulness": "每句可独立用于真实交流。",
    "coreChunkCoverage": "核心表达按蓝图覆盖。",
    "difficultyDistribution": "保持 3/4/6/3 配额。",
    "difficultyCurve": "由基础表达逐步加入细节和整合。",
    "repetitionQuality": "避免仅替换名词的伪变化。",
    "fillerRisk": "低。"
  },
  "humanReviewFocus": [
    "抽查挑战句的自然口语感。"
  ],
  "needsHumanReview": true
}
