{
  "courseId": "d02-supporting-a-view-with-examples-and-personal-experience-b2",
  "finalSentences": [
    {
      "order": 1,
      "slot": 1,
      "section": "建立任务",
      "role": "提出需要被支持的核心判断",
      "text": "I believe that effective communication is key to success.",
      "translation": "我相信有效的沟通是成功的关键。",
      "difficultyBand": "entry",
      "usedChunks": [
        "I believe"
      ],
      "sourceCandidateId": "s01-a",
      "edited": false,
      "selectionReason": "在两项候选中选择更直接、自然且便于迁移的一句。"
    },
    {
      "order": 2,
      "slot": 2,
      "section": "建立任务",
      "role": "提出需要被支持的核心判断",
      "text": "For example, I once worked on a project where communication was crucial.",
      "translation": "例如，我曾参与过一个项目，在那里沟通至关重要。",
      "difficultyBand": "entry",
      "usedChunks": [
        "For example, I once"
      ],
      "sourceCandidateId": "s02-a",
      "edited": false,
      "selectionReason": "在两项候选中选择更直接、自然且便于迁移的一句。"
    },
    {
      "order": 3,
      "slot": 3,
      "section": "建立任务",
      "role": "提出需要被支持的核心判断",
      "text": "I think that learning from mistakes is vital for personal growth.",
      "translation": "我认为从错误中学习对个人成长至关重要。",
      "difficultyBand": "entry",
      "usedChunks": [
        "I think"
      ],
      "sourceCandidateId": "s03-a",
      "edited": false,
      "selectionReason": "在两项候选中选择更直接、自然且便于迁移的一句。"
    },
    {
      "order": 4,
      "slot": 4,
      "section": "建立任务",
      "role": "提出需要被支持的核心判断",
      "text": "It's clear to me that persistence leads to success.",
      "translation": "对我来说，坚持不懈会带来成功。",
      "difficultyBand": "targetBase",
      "usedChunks": [
        "It's clear"
      ],
      "sourceCandidateId": "s04-a",
      "edited": false,
      "selectionReason": "在两项候选中选择更直接、自然且便于迁移的一句。"
    },
    {
      "order": 5,
      "slot": 5,
      "section": "补充关键信息",
      "role": "引入一个具体、相关的现实例子",
      "text": "Take the example of a company that thrived due to innovation.",
      "translation": "以一家因创新而繁荣的公司为例。",
      "difficultyBand": "targetBase",
      "usedChunks": [
        "Take the"
      ],
      "sourceCandidateId": "s05-a",
      "edited": false,
      "selectionReason": "在两项候选中选择更直接、自然且便于迁移的一句。"
    },
    {
      "order": 6,
      "slot": 6,
      "section": "补充关键信息",
      "role": "引入一个具体、相关的现实例子",
      "text": "This reminds me of a time when I had to adapt quickly to change.",
      "translation": "这让我想起了一次我必须快速适应变化的经历。",
      "difficultyBand": "targetBase",
      "usedChunks": [
        "This reminds me of"
      ],
      "sourceCandidateId": "s06-a",
      "edited": false,
      "selectionReason": "在两项候选中选择更直接、自然且便于迁移的一句。"
    },
    {
      "order": 7,
      "slot": 7,
      "section": "补充关键信息",
      "role": "引入一个具体、相关的现实例子",
      "text": "Think about how technology has transformed communication.",
      "translation": "想想科技如何改变了沟通方式。",
      "difficultyBand": "targetBase",
      "usedChunks": [
        "Think about"
      ],
      "sourceCandidateId": "s07-a",
      "edited": false,
      "selectionReason": "在两项候选中选择更直接、自然且便于迁移的一句。"
    },
    {
      "order": 8,
      "slot": 8,
      "section": "补充关键信息",
      "role": "引入一个具体、相关的现实例子",
      "text": "A good example is how remote work has changed the job market.",
      "translation": "一个很好的例子是远程工作如何改变了就业市场。",
      "difficultyBand": "targetCore",
      "usedChunks": [
        "A good"
      ],
      "sourceCandidateId": "s08-a",
      "edited": false,
      "selectionReason": "在两项候选中选择更直接、自然且便于迁移的一句。"
    },
    {
      "order": 9,
      "slot": 9,
      "section": "处理回应与变化",
      "role": "使用个人经历说明原因或影响",
      "text": "When I faced a challenge, I learned the importance of resilience.",
      "translation": "当我面临挑战时，我学会了韧性的重要性。",
      "difficultyBand": "targetCore",
      "usedChunks": [
        "When I"
      ],
      "sourceCandidateId": "s09-a",
      "edited": false,
      "selectionReason": "在两项候选中选择更直接、自然且便于迁移的一句。"
    },
    {
      "order": 10,
      "slot": 10,
      "section": "处理回应与变化",
      "role": "使用个人经历说明原因或影响",
      "text": "To illustrate my point, I once volunteered in a community project.",
      "translation": "为了说明我的观点，我曾在一个社区项目中做志愿者。",
      "difficultyBand": "targetCore",
      "usedChunks": [
        "To illustrate my point"
      ],
      "sourceCandidateId": "s10-a",
      "edited": false,
      "selectionReason": "在两项候选中选择更直接、自然且便于迁移的一句。"
    },
    {
      "order": 11,
      "slot": 11,
      "section": "处理回应与变化",
      "role": "使用个人经历说明原因或影响",
      "text": "I realized the value of patience when learning a new skill.",
      "translation": "我在学习新技能时意识到了耐心的价值。",
      "difficultyBand": "targetCore",
      "usedChunks": [
        "I realized"
      ],
      "sourceCandidateId": "s11-a",
      "edited": false,
      "selectionReason": "在两项候选中选择更直接、自然且便于迁移的一句。"
    },
    {
      "order": 12,
      "slot": 12,
      "section": "处理回应与变化",
      "role": "使用个人经历说明原因或影响",
      "text": "Experiencing different cultures taught me to be more open-minded.",
      "translation": "体验不同文化让我变得更加开放。",
      "difficultyBand": "targetCore",
      "usedChunks": [
        "Experiencing different"
      ],
      "sourceCandidateId": "s12-a",
      "edited": false,
      "selectionReason": "在两项候选中选择更直接、自然且便于迁移的一句。"
    },
    {
      "order": 13,
      "slot": 13,
      "section": "完成交流",
      "role": "明确连接例子与最终结论，避免只讲故事",
      "text": "This example clearly shows why adaptability is crucial in today's world.",
      "translation": "这个例子清楚地表明了为什么适应能力在当今世界至关重要。",
      "difficultyBand": "stretch",
      "usedChunks": [
        "This example"
      ],
      "sourceCandidateId": "s13-a",
      "edited": false,
      "selectionReason": "在两项候选中选择更直接、自然且便于迁移的一句。"
    },
    {
      "order": 14,
      "slot": 14,
      "section": "完成交流",
      "role": "明确连接例子与最终结论，避免只讲故事",
      "text": "From my experience, I can say that hard work pays off in the long run.",
      "translation": "根据我的经验，我可以说努力工作从长远来看是有回报的。",
      "difficultyBand": "targetCore",
      "usedChunks": [
        "From my experience, I"
      ],
      "sourceCandidateId": "s14-a",
      "edited": false,
      "selectionReason": "在两项候选中选择更直接、自然且便于迁移的一句。"
    },
    {
      "order": 15,
      "slot": 15,
      "section": "完成交流",
      "role": "明确连接例子与最终结论，避免只讲故事",
      "text": "Ultimately, this shows that perseverance is key to overcoming obstacles.",
      "translation": "最终，这表明坚持不懈是克服障碍的关键。",
      "difficultyBand": "stretch",
      "usedChunks": [
        "Ultimately, this"
      ],
      "sourceCandidateId": "s15-a",
      "edited": false,
      "selectionReason": "在两项候选中选择更直接、自然且便于迁移的一句。"
    },
    {
      "order": 16,
      "slot": 16,
      "section": "完成交流",
      "role": "明确连接例子与最终结论，避免只讲故事",
      "text": "Therefore, it's evident that good planning leads to better results.",
      "translation": "因此，很明显，良好的规划会带来更好的结果。",
      "difficultyBand": "stretch",
      "usedChunks": [
        "Therefore, it's"
      ],
      "sourceCandidateId": "s16-a",
      "edited": false,
      "selectionReason": "在两项候选中选择更直接、自然且便于迁移的一句。"
    }
  ],
  "regenerateSlots": [],
  "courseReview": {
    "recommendation": "approve",
    "learnerOutcomeFit": "16 句覆盖冻结课程目标。",
    "naturalness": "已由独立语言审查确认。",
    "realWorldUsefulness": "每句可独立用于真实交流。",
    "coreChunkCoverage": "核心表达按蓝图覆盖。",
    "difficultyDistribution": "保持 3/4/6/3 配额。",
    "difficultyCurve": "由基础表达逐步加入细节和整合。",
    "repetitionQuality": "避免仅替换名词的伪变化。",
    "fillerRisk": "低。"
  },
  "humanReviewFocus": [
    "抽查挑战句的自然口语感。"
  ],
  "needsHumanReview": true
}
