{
  "courseId": "a07-changing-a-reservation-or-appointment-b1",
  "finalSentences": [
    {
      "order": 1,
      "slot": 1,
      "section": "建立任务",
      "role": "说明现有预订或预约信息",
      "text": "I have a reservation for dinner at 7 PM.",
      "translation": "我有一个晚上七点的晚餐预订。",
      "difficultyBand": "entry",
      "usedChunks": [
        "I have"
      ],
      "sourceCandidateId": "s01-a",
      "edited": false,
      "selectionReason": "在两项候选中选择更直接、自然且便于迁移的一句。"
    },
    {
      "order": 2,
      "slot": 2,
      "section": "建立任务",
      "role": "说明现有预订或预约信息",
      "text": "I need to change my dinner reservation.",
      "translation": "我需要更改我的晚餐预订。",
      "difficultyBand": "entry",
      "usedChunks": [
        "I need to change"
      ],
      "sourceCandidateId": "s02-a",
      "edited": false,
      "selectionReason": "在两项候选中选择更直接、自然且便于迁移的一句。"
    },
    {
      "order": 3,
      "slot": 3,
      "section": "建立任务",
      "role": "说明现有预订或预约信息",
      "text": "The reservation is under the name Smith.",
      "translation": "预订是在史密斯的名字下。",
      "difficultyBand": "entry",
      "usedChunks": [
        "The reservation"
      ],
      "sourceCandidateId": "s03-a",
      "edited": false,
      "selectionReason": "在两项候选中选择更直接、自然且便于迁移的一句。"
    },
    {
      "order": 4,
      "slot": 4,
      "section": "建立任务",
      "role": "说明现有预订或预约信息",
      "text": "I booked a table for four at your restaurant.",
      "translation": "我在你们餐厅预订了一张四人桌。",
      "difficultyBand": "targetBase",
      "usedChunks": [
        "I booked"
      ],
      "sourceCandidateId": "s04-a",
      "edited": false,
      "selectionReason": "在两项候选中选择更直接、自然且便于迁移的一句。"
    },
    {
      "order": 5,
      "slot": 5,
      "section": "补充关键信息",
      "role": "提出改时间、改人数或改服务内容的请求",
      "text": "Could we change the reservation to 8 PM?",
      "translation": "我们可以把预订改到晚上八点吗？",
      "difficultyBand": "targetBase",
      "usedChunks": [
        "Could we"
      ],
      "sourceCandidateId": "s05-a",
      "edited": false,
      "selectionReason": "在两项候选中选择更直接、自然且便于迁移的一句。"
    },
    {
      "order": 6,
      "slot": 6,
      "section": "补充关键信息",
      "role": "提出改时间、改人数或改服务内容的请求",
      "text": "Can we reschedule for next week?",
      "translation": "我们可以改到下周吗？",
      "difficultyBand": "targetBase",
      "usedChunks": [
        "Can we reschedule for"
      ],
      "sourceCandidateId": "s06-a",
      "edited": false,
      "selectionReason": "在两项候选中选择更直接、自然且便于迁移的一句。"
    },
    {
      "order": 7,
      "slot": 7,
      "section": "补充关键信息",
      "role": "提出改时间、改人数或改服务内容的请求",
      "text": "I'd like to switch to a different service.",
      "translation": "我想换一个不同的服务。",
      "difficultyBand": "targetBase",
      "usedChunks": [
        "I'd like"
      ],
      "sourceCandidateId": "s07-a",
      "edited": false,
      "selectionReason": "在两项候选中选择更直接、自然且便于迁移的一句。"
    },
    {
      "order": 8,
      "slot": 8,
      "section": "补充关键信息",
      "role": "提出改时间、改人数或改服务内容的请求",
      "text": "Can we change the date to the 15th?",
      "translation": "我们可以把日期改到15号吗？",
      "difficultyBand": "targetCore",
      "usedChunks": [
        "Can we"
      ],
      "sourceCandidateId": "s08-a",
      "edited": false,
      "selectionReason": "在两项候选中选择更直接、自然且便于迁移的一句。"
    },
    {
      "order": 9,
      "slot": 9,
      "section": "处理回应与变化",
      "role": "说明原因、时间限制和可接受的替代方案",
      "text": "I have a conflict with the original time.",
      "translation": "我和原来的时间有冲突。",
      "difficultyBand": "targetCore",
      "usedChunks": [
        "I have"
      ],
      "sourceCandidateId": "s09-a",
      "edited": false,
      "selectionReason": "在两项候选中选择更直接、自然且便于迁移的一句。"
    },
    {
      "order": 10,
      "slot": 10,
      "section": "处理回应与变化",
      "role": "说明原因、时间限制和可接受的替代方案",
      "text": "Is there a fee for changing the reservation?",
      "translation": "更改预订需要收费吗？",
      "difficultyBand": "targetCore",
      "usedChunks": [
        "Is there a fee for"
      ],
      "sourceCandidateId": "s10-a",
      "edited": false,
      "selectionReason": "在两项候选中选择更直接、自然且便于迁移的一句。"
    },
    {
      "order": 11,
      "slot": 11,
      "section": "处理回应与变化",
      "role": "说明原因、时间限制和可接受的替代方案",
      "text": "I need to adjust due to a work meeting.",
      "translation": "我需要调整，因为有个工作会议。",
      "difficultyBand": "targetCore",
      "usedChunks": [
        "I need"
      ],
      "sourceCandidateId": "s11-a",
      "edited": false,
      "selectionReason": "在两项候选中选择更直接、自然且便于迁移的一句。"
    },
    {
      "order": 12,
      "slot": 12,
      "section": "处理回应与变化",
      "role": "说明原因、时间限制和可接受的替代方案",
      "text": "I can only make it after 5 PM.",
      "translation": "我只能在下午五点以后到。",
      "difficultyBand": "targetCore",
      "usedChunks": [
        "I can"
      ],
      "sourceCandidateId": "s12-a",
      "edited": false,
      "selectionReason": "在两项候选中选择更直接、自然且便于迁移的一句。"
    },
    {
      "order": 13,
      "slot": 13,
      "section": "完成交流",
      "role": "确认新的日期、时间、费用或变更结果",
      "text": "The new reservation is confirmed for 8 PM.",
      "translation": "新的预订确认在晚上八点。",
      "difficultyBand": "stretch",
      "usedChunks": [
        "The new"
      ],
      "sourceCandidateId": "s13-a",
      "edited": false,
      "selectionReason": "在两项候选中选择更直接、自然且便于迁移的一句。"
    },
    {
      "order": 14,
      "slot": 14,
      "section": "完成交流",
      "role": "确认新的日期、时间、费用或变更结果",
      "text": "Could you confirm the new time with me?",
      "translation": "你能和我确认一下新时间吗？",
      "difficultyBand": "targetCore",
      "usedChunks": [
        "Could you confirm the new"
      ],
      "sourceCandidateId": "s14-a",
      "edited": false,
      "selectionReason": "在两项候选中选择更直接、自然且便于迁移的一句。"
    },
    {
      "order": 15,
      "slot": 15,
      "section": "完成交流",
      "role": "确认新的日期、时间、费用或变更结果",
      "text": "The updated details are all set, thank you.",
      "translation": "更新的细节都已安排好，谢谢。",
      "difficultyBand": "stretch",
      "usedChunks": [
        "The updated"
      ],
      "sourceCandidateId": "s15-a",
      "edited": false,
      "selectionReason": "在两项候选中选择更直接、自然且便于迁移的一句。"
    },
    {
      "order": 16,
      "slot": 16,
      "section": "完成交流",
      "role": "确认新的日期、时间、费用或变更结果",
      "text": "Thanks for helping me with the changes.",
      "translation": "谢谢你帮我做出更改。",
      "difficultyBand": "stretch",
      "usedChunks": [
        "Thanks for"
      ],
      "sourceCandidateId": "s16-a",
      "edited": false,
      "selectionReason": "在两项候选中选择更直接、自然且便于迁移的一句。"
    }
  ],
  "regenerateSlots": [],
  "courseReview": {
    "recommendation": "approve",
    "learnerOutcomeFit": "16 句覆盖冻结课程目标。",
    "naturalness": "已由独立语言审查确认。",
    "realWorldUsefulness": "每句可独立用于真实交流。",
    "coreChunkCoverage": "核心表达按蓝图覆盖。",
    "difficultyDistribution": "保持 3/4/6/3 配额。",
    "difficultyCurve": "由基础表达逐步加入细节和整合。",
    "repetitionQuality": "避免仅替换名词的伪变化。",
    "fillerRisk": "低。"
  },
  "humanReviewFocus": [
    "抽查挑战句的自然口语感。"
  ],
  "needsHumanReview": true
}
